tic,SP_ENTITY_NAME,SP_ENTITY_ID,SP_BUSINESS_DESCRIPTION,SP_LONG_BUSINESS_DESCRIPTION,SP_TOPICTAG,SP_TICKER,SP_EXCHANGE_TICKER,SP_COMPANY_NAME,_merge,YH_BUS_DESC,SA_BUS_DESC
EW,Edwards Lifesciences Corporation (NYSE:EW),4812781.0,Edwards Lifesciences Corporation provides products and technologies for structural heart disease and,Edwards Lifesciences Corporation operates as a manufacturer of heart valve systems and repair produc,Health Diagnostics; Cardiovascular; Surgery,EW,NYSE:EW,Edwards Lifesciences Corporation,both,Edwards Lifesciences Corporation provides products and technologies for structural heart disease and,Edwards Lifesciences Corporation provides products and technologies for structural heart disease and
DENN,Denny's Corporation (NASDAQCM:DENN),4422137.0,"Denny's Corporation, through its subsidiaries, owns and operates franchised full-service restaurant ",Denny's Corporation operates franchised full-service restaurant chains. The company owns and operate,,DENN,NASDAQCM:DENN,Denny's Corporation,both,"Denny's Corporation, through its subsidiaries, owns and operates franchised full-service restaurant ","Denny's Corporation, through its subsidiaries, owns and operates franchised full-service restaurant "
PBI,Pitney Bowes Inc. (NYSE:PBI),103699.0,"Pitney Bowes Inc., a shipping and mailing company, provides technology, logistics, and financial ser","Pitney Bowes Inc. is a global shipping and mailing company that provides technology, logistics, and ",Cloud Management; Data Integration; Data Protection; Cloud Infrastructure; Cloud Storage; Courier Service; Team Collaboration,PBI,NYSE:PBI,Pitney Bowes Inc.,both,"Pitney Bowes Inc., a shipping and mailing company, provides technology, logistics, and financial ser","Pitney Bowes Inc., a shipping and mailing company, provides technology, logistics, and financial ser"
TER,"Teradyne, Inc. (NASDAQGS:TER)",4071231.0,"Teradyne, Inc. designs, develops, manufactures, and sells automated test systems and robotics produc","Teradyne, Inc. (Teradyne) is a global supplier of automated test equipment and robotics solutions.

",Industrial Automation; Sensors; Data Protection; Process Automation; Artificial Intelligence; Autonomous Vehicles; 5G,TER,NASDAQGS:TER,"Teradyne, Inc.",both,"Teradyne, Inc. designs, develops, manufactures, and sells automated test systems and robotics produc","Teradyne, Inc. designs, develops, manufactures, and sells automated test systems and robotics produc"
LDOS,"Leidos Holdings, Inc. (NYSE:LDOS)",4276840.0,"Leidos Holdings, Inc., together with its subsidiaries, provides services and solutions in the defens","Leidos Holdings, Inc. (Leidos) engages in developing smarter technology solutions, particularly for ",Software Development; Cloud Management; Data Integration; Data Protection; Cloud Infrastructure; Cloud Security; Process Automation,LDOS,NYSE:LDOS,"Leidos Holdings, Inc.",both,"Leidos Holdings, Inc., together with its subsidiaries, provides services and solutions in the defens","Leidos Holdings, Inc., together with its subsidiaries, provides services and solutions in the defens"
HL,Hecla Mining Company (NYSE:HL),4130678.0,"Hecla Mining Company, together with its subsidiaries, provides precious and base metal properties in","Hecla Mining Company and its subsidiaries discover, acquire, and develop mines and other mineral int",,HL,NYSE:HL,Hecla Mining Company,both,"Hecla Mining Company, together with its subsidiaries, provides precious and base metal properties in","Hecla Mining Company, together with its subsidiaries, provides precious and base metal properties in"
NATI,National Instruments Corporation (NASDAQGM:NATI),4100208.0,National Instruments Corporation provides a software-centric platform to engineers and scientists wo,"National Instruments Corporation provides flexible application software and modular, multifunction h",Data Integration; Mobile Development Tools; DaaS,NATI,NASDAQGM:NATI,National Instruments Corporation,both,nan,nan
SAFM,"Sanderson Farms, Inc. (NASDAQGM:SAFM)",4915624.0,"Sanderson Farms, Inc., an integrated poultry processing company, produces, processes, markets, and d","Sanderson Farms, Inc. operates as a vertically integrated poultry processing company.

The company e",,SAFM,NASDAQGM:SAFM,"Sanderson Farms, Inc.",both,nan,nan
MAT,"Mattel, Inc. (NASDAQGS:MAT)",4097451.0,"Mattel, Inc., a toy and family entertainment company, designs, manufactures, and markets toys and co","Mattel, Inc. (Mattel) is a leading global toy and family entertainment company and owner of one of t",Lifestyle; Virtual Goods; Animation/av Workstations; Video Games,MAT,NASDAQGS:MAT,"Mattel, Inc.",both,"Mattel, Inc., a toy and family entertainment company, designs, manufactures, and markets toys and co","Mattel, Inc., a toy and family entertainment company, designs, manufactures, and markets toys and co"
HAE,Haemonetics Corporation (NYSE:HAE),4068708.0,"Haemonetics Corporation, a healthcare company, provides suite of medical products and solutions in t",Haemonetics Corporation (Haemonetics) is a global healthcare company dedicated to providing a suite ,Health Diagnostics; Artificial Intelligence; Cardiovascular; Hematology; Immunology; Surgery,HAE,NYSE:HAE,Haemonetics Corporation,both,"Haemonetics Corporation, a healthcare company, provides suite of medical products and solutions in t","Haemonetics Corporation, a healthcare company, provides suite of medical products and solutions in t"
AVT,"Avnet, Inc. (NASDAQGS:AVT)",4004310.0,"Avnet, Inc., distributes electronic component technology. The company operates through two segments,","Avnet, Inc. its consolidated subsidiaries (Avnet) operate as a global electronic component technolog",Software Development; Data Integration; Industrial Automation; Sensors; E-Discovery; Process Automation,AVT,NASDAQGS:AVT,"Avnet, Inc.",both,"Avnet, Inc., distributes electronic component technology. The company operates through two segments,","Avnet, Inc., distributes electronic component technology. The company operates through two segments,"
FLOW,"SPX FLOW, Inc. (NYSE:FLOW)",4992827.0,"SPX FLOW, Inc. researches, designs, develops, delivers, and services process technology solutions th","SPX FLOW, Inc. operates in nutrition and health, and precision solutions businesses. The product off",,FLOW,NYSE:FLOW,"SPX FLOW, Inc.",both,"The fund invests at least 80% of its net assets, plus the amount of any borrowings for investment pu",nan
CHTR,"Charter Communications, Inc. (NASDAQGS:CHTR)",4121481.0,"Charter Communications, Inc. operates as a broadband connectivity and cable operator company serving","Charter Communications, Inc. operates as a leading broadband connectivity company and cable operator",Network Backbone; Ad Network; Video Streaming; VoIP; Streaming Media; Network Security; 5G,CHTR,NASDAQGS:CHTR,"Charter Communications, Inc.",both,"Charter Communications, Inc. operates as a broadband connectivity and cable operator company serving","Charter Communications, Inc. operates as a broadband connectivity and cable operator company serving"
OII,"Oceaneering International, Inc. (NYSE:OII)",4010843.0,"Oceaneering International, Inc. provides engineered services and products, and robotic solutions to ","Oceaneering International, Inc. (Oceaneering) is a global technology company. The company is deliver",Environmental Engineering; Industrial Automation; Marine Transportation; Simulation; Process Automation; Ocean Data Collection; Autonomous Vehicles,OII,NYSE:OII,"Oceaneering International, Inc.",both,"Oceaneering International, Inc. provides engineered services and products, and robotic solutions to ","Oceaneering International, Inc. provides engineered services and products, and robotic solutions to "
GCI,"Gannett Co., Inc. (NYSE:GCI)",4426551.0,"Gannett Co., Inc. operates as a media and marketing solutions company in the United States. It opera","Gannett Co., Inc. (Gannett) is a diversified media company.

The company seeks to inspire, inform, a",Digital Media; Marketing Automation; Social Media Marketing; Customer Analytics; Ad Targeting; Brand Marketing; Content Creation,GCI,NYSE:GCI,"Gannett Co., Inc.",both,"Gannett Co., Inc. operates as a media and marketing solutions company in the United States. It opera","Gannett Co., Inc. operates as a media and marketing solutions company in the United States. It opera"
HWKN,"Hawkins, Inc. (NASDAQGS:HWKN)",4986299.0,"Hawkins, Inc. operates as a specialty chemical and ingredients company in the United States. It oper","Hawkins, Inc. (Hawkins) operates as a specialty chemical and ingredients company.

The company formu",Environmental Engineering; Disposal and Recycling; Water Purification; Nutraceutical,HWKN,NASDAQGS:HWKN,"Hawkins, Inc.",both,"Hawkins, Inc. operates as a specialty chemical and ingredients company in the United States. It oper","Hawkins, Inc. operates as a specialty chemical and ingredients company in the United States. It oper"
PKE,Park Aerospace Corp. (NYSE:PKE),4964140.0,"Park Aerospace Corp., an aerospace company, develops and manufactures solution and hot-melt advanced","Park Aerospace Corp. and its subsidiaries (Park) operate as an aerospace company.

The company devel",Environmental Engineering,PKE,NYSE:PKE,Park Aerospace Corp.,both,"Park Aerospace Corp., an aerospace company, develops and manufactures solution and hot-melt advanced","Park Aerospace Corp., an aerospace company, develops and manufactures solution and hot-melt advanced"
MRC,MRC Global Inc. (NYSE:MRC),4326704.0,"MRC Global Inc., through its subsidiaries, distributes pipes, valves, fittings, and other infrastruc","MRC Global Inc. is the leading global distributor of pipe, valves and fittings (PVF) and other infra",Cloud Management; Data Integration; Energy Storage; Industrial Automation; Cloud Storage; Process Automation; Artificial Intelligence,MRC,NYSE:MRC,MRC Global Inc.,both,"MRC Global Inc., through its subsidiaries, distributes pipes, valves, fittings, and other infrastruc","MRC Global Inc., through its subsidiaries, distributes pipes, valves, fittings, and other infrastruc"
TMX,"Terminix Global Holdings, Inc. (NYSE:TMX)",4914221.0,"Terminix Global Holdings, Inc., through its subsidiaries, provides residential and commercial termit","Terminix Global Holdings, Inc. provides residential and commercial termite and pest management servi",Social Media Marketing; Brand Marketing,TMX,NYSE:TMX,"Terminix Global Holdings, Inc.",both,nan,nan
HEES,"H&E Equipment Services, Inc. (NASDAQGS:HEES)",4993180.0,"H&E Equipment Services, Inc. operates as an integrated equipment services company in the United Stat","H&E Equipment Services, Inc. operates as a rental equipment company.

The company has built an exten",Industrial Automation,HEES,NASDAQGS:HEES,"H&E Equipment Services, Inc.",both,"H&E Equipment Services, Inc. operates as an integrated equipment services company in the United Stat","H&E Equipment Services, Inc. operates as an integrated equipment services company in the United Stat"
CIR,"CIRCOR International, Inc. (NYSE:CIR)",4391536.0,"CIRCOR International, Inc. designs, manufactures, and distributes flow and motion control products i","CIRCOR International, Inc. and its subsidiaries (CIRCOR) designs, manufactures, and markets differen",,CIR,NYSE:CIR,"CIRCOR International, Inc.",both,nan,nan
ECPG,"Encore Capital Group, Inc. (NASDAQGS:ECPG)",4049160.0,"Encore Capital Group, Inc., a specialty finance company, provides debt recovery solutions and other ","Encore Capital Group, Inc. operates as an international specialty finance company.

The company is p",Anti-Fraud; Consumer Lending; Predictive Analytics; Data Protection; RegTech,ECPG,NASDAQGS:ECPG,"Encore Capital Group, Inc.",both,"Encore Capital Group, Inc., a specialty finance company, provides debt recovery solutions and other ","Encore Capital Group, Inc., a specialty finance company, provides debt recovery solutions and other "
EBAY,eBay Inc. (NASDAQGS:EBAY),4081627.0,"eBay Inc., together with its subsidiaries, operates marketplace platforms that connect buyers and se",eBay Inc. (eBay) operates as a global commerce leader that connects people and builds communities to,Crowdsourcing; Fintech; Online Payments,EBAY,NASDAQGS:EBAY,eBay Inc.,both,"eBay Inc., together with its subsidiaries, operates marketplace platforms that connect buyers and se","eBay Inc., together with its subsidiaries, operates marketplace platforms that connect buyers and se"
GFF,Griffon Corporation (NYSE:GFF),4987594.0,"Griffon Corporation, through its subsidiaries, provides consumer and professional, and home and buil",Griffon Corporation (Griffon) is a diversified management and holding company that conducts business,Fast-Moving Consumer Goods; Home Improvement,GFF,NYSE:GFF,Griffon Corporation,both,"Griffon Corporation, through its subsidiaries, provides consumer and professional, and home and buil","Griffon Corporation, through its subsidiaries, provides consumer and professional, and home and buil"
BW,"Babcock & Wilcox Enterprises, Inc. (NYSE:BW)",4599506.0,"Babcock & Wilcox Enterprises, Inc., together with its subsidiaries, provides energy and emissions co","Babcock & Wilcox Enterprises, Inc. (B&W) operates as a growing, globally-focused renewable, environm",Energy Efficiency; Energy Management; Environmental Engineering; Disposal and Recycling; CleanTech; Pollution Control; Biomass Energy; Green Steel,BW,NYSE:BW,"Babcock & Wilcox Enterprises, Inc.",both,"Babcock & Wilcox Enterprises, Inc., together with its subsidiaries, provides energy and emissions co","Babcock & Wilcox Enterprises, Inc., together with its subsidiaries, provides energy and emissions co"
GT,The Goodyear Tire & Rubber Company (NASDAQGS:GT),4060262.0,"The Goodyear Tire & Rubber Company, together with its subsidiaries, develops, manufactures, distribu","The Goodyear Tire & Rubber Company (Goodyear) operates as a manufacturer of tires worldwide.

The co",Data Protection,GT,NASDAQGS:GT,The Goodyear Tire & Rubber Company,both,"The Goodyear Tire & Rubber Company, together with its subsidiaries, develops, manufactures, distribu","The Goodyear Tire & Rubber Company, together with its subsidiaries, develops, manufactures, distribu"
BCO,The Brink's Company (NYSE:BCO),4513682.0,"The Brink's Company provides secure transportation, cash management, and other security-related serv","The Brink's Company is a global provider of cash and valuables management, digital retail solutions,",Fleet Management; Freight Service; Physical Security; Courier Service; Security Management,BCO,NYSE:BCO,The Brink's Company,both,"The Brink's Company provides secure transportation, cash management, and other security-related serv","The Brink's Company provides secure transportation, cash management, and other security-related serv"
KODK,Eastman Kodak Company (NYSE:KODK),105346.0,"Eastman Kodak Company engages in the provision of hardware, software, consumables, and services to c",Eastman Kodak Company (Kodak) is a global manufacturer focused on commercial print and advanced mate,Industrial Automation; Digital Asset Management; Data Protection; Process Automation; 3D Printing; Storage Management; Artificial Intelligence,KODK,NYSE:KODK,Eastman Kodak Company,both,"Eastman Kodak Company engages in the provision of hardware, software, consumables, and services to c","Eastman Kodak Company engages in the provision of hardware, software, consumables, and services to c"
HCC,"Warrior Met Coal, Inc. (NYSE:HCC)",4641273.0,"Warrior Met Coal, Inc. engages in the production and export of non-thermal steelmaking metallurgical","Warrior Met Coal, Inc., together with its subsidiaries, operates as a U.S.-based, environmentally an",Environmental Engineering; CleanTech,HCC,NYSE:HCC,"Warrior Met Coal, Inc.",both,"Warrior Met Coal, Inc. engages in the production and export of non-thermal steelmaking metallurgical","Warrior Met Coal, Inc. engages in the production and export of non-thermal steelmaking metallurgical"
JWN,"Nordstrom, Inc. (NYSE:JWN)",4053619.0,"Nordstrom, Inc., a fashion retailer, provides apparels, shoes, beauty, accessories, and home goods f","Nordstrom, Inc. operates as a fashion retailer.

The company offers an extensive selection of high-q",Lifestyle; Brand Marketing,JWN,NYSE:JWN,"Nordstrom, Inc.",both,"Nordstrom, Inc., a fashion retailer, provides apparels, shoes, beauty, accessories, and home goods f","Nordstrom, Inc., a fashion retailer, provides apparels, shoes, beauty, accessories, and home goods f"
MOS,The Mosaic Company (NYSE:MOS),4097833.0,"The Mosaic Company, through its subsidiaries, produces and markets concentrated phosphate and potash",The Mosaic Company (Mosaic) produces and markets concentrated phosphate and potash crop nutrients. T,Animal Feed; Environmental Engineering; Farming; Horticulture,MOS,NYSE:MOS,The Mosaic Company,both,nan,"The Mosaic Company, through its subsidiaries, produces and markets concentrated phosphate and potash"
HWC,Hancock Whitney Corporation (NASDAQGS:HWC),100308.0,Hancock Whitney Corporation operates as the financial holding company for Hancock Whitney Bank that ,Hancock Whitney Corporation operates as the bank holding company for Hancock Whitney Bank that provi,Consumer Lending,HWC,NASDAQGS:HWC,Hancock Whitney Corporation,both,Hancock Whitney Corporation operates as the financial holding company for Hancock Whitney Bank that ,Hancock Whitney Corporation operates as the financial holding company for Hancock Whitney Bank that 
DHI,"D.R. Horton, Inc. (NYSE:DHI)",4049266.0,"D.R. Horton, Inc. operates as a homebuilding company in East, North, Southeast, South Central, South","D.R. Horton, Inc. operates as the homebuilding company in the United States. The company constructs ",Consumer Lending; Home Improvement,DHI,NYSE:DHI,"D.R. Horton, Inc.",both,"D.R. Horton, Inc. operates as a homebuilding company in East, North, Southeast, South Central, South","D.R. Horton, Inc. operates as a homebuilding company in East, North, Southeast, South Central, South"
NCLH,Norwegian Cruise Line Holdings Ltd. (NYSE:NCLH),4232236.0,"Norwegian Cruise Line Holdings Ltd., together with its subsidiaries, operates as a cruise company in","Norwegian Cruise Line Holdings Ltd. (Norwegian) operates as a global cruise company, which operates ",Adventure Travel; Tourism; Travel Accommodations,NCLH,NYSE:NCLH,Norwegian Cruise Line Holdings Ltd.,both,"Norwegian Cruise Line Holdings Ltd., together with its subsidiaries, operates as a cruise company in","Norwegian Cruise Line Holdings Ltd., together with its subsidiaries, operates as a cruise company in"
PLD,"Prologis, Inc. (NYSE:PLD)",103146.0,"Prologis, Inc. is the global leader in logistics real estate with a focus on high-barrier, high-grow",nan,Utility Scale Solar,PLD,NYSE:PLD,"Prologis, Inc.",both,"Prologis, Inc. is the global leader in logistics real estate with a focus on high-barrier, high-grow","Prologis, Inc. is the global leader in logistics real estate with a focus on high-barrier, high-grow"
CTVA,"Corteva, Inc. (NYSE:CTVA)",14170965.0,"Corteva, Inc. operates in the agriculture business. It operates through two segments, Seed and Crop ","Corteva, Inc. (Corteva) operates as a global provider of seed and crop protection solutions focused ",Farming; Horticulture,CTVA,NYSE:CTVA,"Corteva, Inc.",both,"Corteva, Inc. operates in the agriculture business. It operates through two segments, Seed and Crop ","Corteva, Inc. operates in the agriculture business. It operates through two segments, Seed and Crop "
LEU,Centrus Energy Corp. (NYSEAM:LEU),4094268.0,Centrus Energy Corp. supplies nuclear fuel components and services for the nuclear power industry in,Centrus Energy Corp. (Centrus) operates as a supplier of nuclear fuel components and services for th,Clean Energy; Energy Management; Conventional Nuclear; Advanced Nuclear,LEU,NYSEAM:LEU,Centrus Energy Corp.,both,Centrus Energy Corp. supplies nuclear fuel components and services for the nuclear power industry in,Centrus Energy Corp. supplies nuclear fuel components and services for the nuclear power industry in
REG,Regency Centers Corporation (NASDAQGS:REG),103091.0,"Regency Centers is a preeminent national owner, operator, and developer of shopping centers located ",nan,,REG,NASDAQGS:REG,Regency Centers Corporation,both,"Regency Centers is a preeminent national owner, operator, and developer of shopping centers located ","Regency Centers is a preeminent national owner, operator, and developer of shopping centers located "
STBA,"S&T Bancorp, Inc. (NASDAQGS:STBA)",100445.0,"S&T Bancorp, Inc. operates as the bank holding company for S&T Bank that engages in the provision of","S&T Bancorp, Inc. operates as the bank holding company for S&T Bank that provides a full range of fi",Consumer Lending,STBA,NASDAQGS:STBA,"S&T Bancorp, Inc.",both,"S&T Bancorp, Inc. operates as the bank holding company for S&T Bank that engages in the provision of","S&T Bancorp, Inc. operates as the bank holding company for S&T Bank that engages in the provision of"
IP,International Paper Company (NYSE:IP),4060689.0,International Paper Company produces and sells renewable fiber-based packaging and pulp products in ,International Paper Company (International Paper) operates as a global producer of renewable fiber-b,Packaging Services; Biomass Energy; Utility Scale Solar,IP,NYSE:IP,International Paper Company,both,International Paper Company produces and sells renewable fiber-based packaging and pulp products in ,International Paper Company produces and sells renewable fiber-based packaging and pulp products in 
AXTA,Axalta Coating Systems Ltd. (NYSE:AXTA),4985766.0,"Axalta Coating Systems Ltd., through its subsidiaries, manufactures, markets, and distributes high-p","Axalta Coating Systems Ltd. is a leading global manufacturer, marketer and distributor of high-perfo",Computer Vision; Environmental Engineering; Industrial Automation; Pollution Control,AXTA,NYSE:AXTA,Axalta Coating Systems Ltd.,both,"Axalta Coating Systems Ltd., through its subsidiaries, manufactures, markets, and distributes high-p","Axalta Coating Systems Ltd., through its subsidiaries, manufactures, markets, and distributes high-p"
BJ,"BJ's Wholesale Club Holdings, Inc. (NYSE:BJ)",8648705.0,"BJ's Wholesale Club Holdings, Inc., together with its subsidiaries, operates warehouse clubs on the ","BJ's Wholesale Club Holdings, Inc. (BJ's or BJ's Wholesale Club) is an operator of membership wareho",Fast-Moving Consumer Goods; Food Delivery; Customer Relationship Management; Brand Marketing; Online Grocery,BJ,NYSE:BJ,"BJ's Wholesale Club Holdings, Inc.",both,"BJ's Wholesale Club Holdings, Inc., together with its subsidiaries, operates warehouse clubs on the ","BJ's Wholesale Club Holdings, Inc., together with its subsidiaries, operates warehouse clubs on the "
MO,"Altria Group, Inc. (NYSE:MO)",4087349.0,"Altria Group, Inc., through its subsidiaries, manufactures and sells smokeable and oral tobacco prod","Altria Group, Inc. (Altria) provides smokeable products and oral tobacco products.

The company has ",,MO,NYSE:MO,"Altria Group, Inc.",both,"Altria Group, Inc., through its subsidiaries, manufactures and sells smokeable and oral tobacco prod","Altria Group, Inc., through its subsidiaries, manufactures and sells smokeable and oral tobacco prod"
MRTN,"Marten Transport, Ltd. (NASDAQGS:MRTN)",4994073.0,"Marten Transport, Ltd. operates as a temperature-sensitive truckload carrier for shippers in the Uni","Marten Transport, Ltd. operates a multifaceted business that offers a network of time and temperatur",Fast-Moving Consumer Goods; Fleet Management; Freight Service,MRTN,NASDAQGS:MRTN,"Marten Transport, Ltd.",both,"Marten Transport, Ltd. operates as a temperature-sensitive truckload carrier for shippers in the Uni","Marten Transport, Ltd. operates as a temperature-sensitive truckload carrier for shippers in the Uni"
VRT,Vertiv Holdings Co (NYSE:VRT),11078438.0,"Vertiv Holdings Co, together with its subsidiaries, designs, manufactures, and services critical dig","Vertiv Holdings Co (Vertiv) is a global leader in the design, manufacturing and servicing of critica",File Sharing; Data Protection; Cloud Infrastructure; Cloud Storage; Process Automation; Data Centers and Facilities; Data Center Technology,VRT,NYSE:VRT,Vertiv Holdings Co,both,"Vertiv Holdings Co, together with its subsidiaries, designs, manufactures, and services critical dig","Vertiv Holdings Co, together with its subsidiaries, designs, manufactures, and services critical dig"
HSIC,"Henry Schein, Inc. (NASDAQGS:HSIC)",4811795.0,"Henry Schein, Inc. provides health care products and services to dental practitioners, laboratories,","Henry Schein, Inc. (Henry Schein) operates as a solutions company for health care professionals powe",Health Diagnostics; MHealth; Dentistry; Orthopaedics; Surgery; Vaccines,HSIC,NASDAQGS:HSIC,"Henry Schein, Inc.",both,"Henry Schein, Inc. provides health care products and services to dental practitioners, laboratories,","Henry Schein, Inc. provides health care products and services to dental practitioners, laboratories,"
OSK,Oshkosh Corporation (NYSE:OSK),4399014.0,Oshkosh Corporation provides purpose-built vehicles and equipment worldwide. The company operates th,"Oshkosh Corporation (Oshkosh) operates as an industrial technology company.

The company is focused ",Fleet Management; Homeland Security; Industrial Automation; Electric Vehicle; Security Management; Autonomous Vehicles,OSK,NYSE:OSK,Oshkosh Corporation,both,Oshkosh Corporation provides purpose-built vehicles and equipment worldwide. The company operates th,Oshkosh Corporation provides purpose-built vehicles and equipment worldwide. The company operates th
