tic,SP_ENTITY_NAME,SP_ENTITY_ID,SP_BUSINESS_DESCRIPTION,SP_LONG_BUSINESS_DESCRIPTION,SP_TOPICTAG,SP_TICKER,SP_EXCHANGE_TICKER,SP_COMPANY_NAME,_merge,YH_BUS_DESC,SA_BUS_DESC
ATI,ATI Inc. (NYSE:ATI),4121020.0,ATI Inc. produces and sells specialty materials and complex components worldwide. It operates in two,"ATI Inc. (ATI) produces specialty materials, highly differentiated by the company's materials scienc",Energy Management; Energy Storage; Industrial Automation; Conventional Nuclear; Pollution Control; Passenger Aircraft Manufacturing,ATI,NYSE:ATI,ATI Inc.,both,ATI Inc. produces and sells specialty materials and complex components worldwide. It operates in two,ATI Inc. produces and sells specialty materials and complex components worldwide. It operates in two
AR,Antero Resources Corporation (NYSE:AR),4166271.0,"Antero Resources Corporation, an independent oil and natural gas company, engages in the development","Antero Resources Corporation (Antero) engages in the development, production, exploration, and acqui",Marine Transportation,AR,NYSE:AR,Antero Resources Corporation,both,"Antero Resources Corporation, an independent oil and natural gas company, engages in the development","Antero Resources Corporation, an independent oil and natural gas company, engages in the development"
ALL,The Allstate Corporation (NYSE:ALL),103247.0,"The Allstate Corporation, together with its subsidiaries, provides property and casualty, and other ",The Allstate Corporation (Allstate) operates as a property and casualty insurance company. The compa,Employee Benefits,ALL,NYSE:ALL,The Allstate Corporation,both,"The Allstate Corporation, together with its subsidiaries, provides property and casualty, and other ","The Allstate Corporation, together with its subsidiaries, provides property and casualty, and other "
NWE,"NorthWestern Energy Group, Inc. (NASDAQGS:NWE)",4057053.0,"NorthWestern Energy Group, Inc. provides electricity and natural gas to residential, commercial, and","NorthWestern Energy Group, Inc. provides electricity and natural gas to customers in Montana, South ",Clean Energy; Energy Efficiency; Energy Management; Energy Storage; Power Grid; Onshore and Offshore Wind,NWE,NASDAQGS:NWE,"NorthWestern Energy Group, Inc.",both,"NorthWestern Energy Group, Inc. provides electricity and natural gas to residential, commercial, and","NorthWestern Energy Group, Inc. provides electricity and natural gas to residential, commercial, and"
MUR,Murphy Oil Corporation (NYSE:MUR),4000820.0,"Murphy Oil Corporation, together with its subsidiaries, operates as an oil and gas exploration and p",Murphy Oil Corporation (Murphy) operates as an oil and natural gas exploration and production compan,,MUR,NYSE:MUR,Murphy Oil Corporation,both,"Murphy Oil Corporation, together with its subsidiaries, operates as an oil and gas exploration and p","Murphy Oil Corporation, together with its subsidiaries, operates as an oil and gas exploration and p"
BE,Bloom Energy Corporation (NYSE:BE),4252232.0,"Bloom Energy Corporation designs, manufactures, sells, and installs solid-oxide fuel cell systems fo","Bloom Energy Corporation (Bloom Energy) designs, manufactures, sells and in certain cases, installs ",Clean Energy; Energy Efficiency; Energy Management; Fuel Cells; Industrial Automation; CleanTech; Smart Energy; Battery Energy Storage System (BESS); Bio-based and Renewable Materials,BE,NYSE:BE,Bloom Energy Corporation,both,"Bloom Energy Corporation designs, manufactures, sells, and installs solid-oxide fuel cell systems fo","Bloom Energy Corporation designs, manufactures, sells, and installs solid-oxide fuel cell systems fo"
TTC,The Toro Company (NYSE:TTC),4107956.0,"The Toro Company designs, manufactures, markets, and sells professional turf maintenance equipment a","The Toro Company designs, manufactures, markets, and sells professional turf maintenance equipment a",Environmental Engineering; Farming; Horticulture; Pollution Control,TTC,NYSE:TTC,The Toro Company,both,"The Toro Company designs, manufactures, markets, and sells professional turf maintenance equipment a","The Toro Company designs, manufactures, markets, and sells professional turf maintenance equipment a"
SATS,EchoStar Corporation (NASDAQGS:SATS),4190757.0,"EchoStar Corporation, together with its subsidiaries, provides networking technologies and services ",nan,Network Backbone; Edge Computing; Network Security; 5G,SATS,NASDAQGS:SATS,EchoStar Corporation,both,"EchoStar Corporation, together with its subsidiaries, provides networking technologies and services ","EchoStar Corporation, together with its subsidiaries, provides networking technologies and services "
TXRH,"Texas Roadhouse, Inc. (NASDAQGS:TXRH)",4422944.0,"Texas Roadhouse, Inc., together with its subsidiaries, operates casual dining restaurants in the Uni","Texas Roadhouse, Inc. is a growing restaurant company operating predominantly in the casual dining s",,TXRH,NASDAQGS:TXRH,"Texas Roadhouse, Inc.",both,"Texas Roadhouse, Inc., together with its subsidiaries, operates casual dining restaurants in the Uni","Texas Roadhouse, Inc., together with its subsidiaries, operates casual dining restaurants in the Uni"
VFC,V.F. Corporation (NYSE:VFC),4004426.0,"V.F. Corporation, together with its subsidiaries, engages in the design, procurement, marketing, and","V. F. Corporation (VF) operates as an apparel, footwear and accessories company worldwide.

VF is di",Fast-Moving Consumer Goods; Lifestyle; Social Media Advertising; Wearables; Brand Marketing; Smart Clothing,VFC,NYSE:VFC,V.F. Corporation,both,"V.F. Corporation, together with its subsidiaries, engages in the design, procurement, marketing, and","V.F. Corporation, together with its subsidiaries, engages in the design, procurement, marketing, and"
IBM,International Business Machines Corporation (NYSE:IBM),4000193.0,"International Business Machines Corporation, together with its subsidiaries, provides integrated sol","International Business Machines Corporation (IBM) engages in the software, consulting, infrastructur",Software Development; Cloud Management; Machine Learning; IaaS (Infrastructure as a Service); Cloud Infrastructure; Cloud Security; Artificial Intelligence; GenAI,IBM,NYSE:IBM,International Business Machines Corporation,both,"International Business Machines Corporation, together with its subsidiaries, provides integrated sol","International Business Machines Corporation, together with its subsidiaries, provides integrated sol"
CDW,CDW Corporation (NASDAQGS:CDW),4114659.0,"CDW Corporation provides information technology (IT) solutions in the United States, the United King","CDW Corporation is a leading multi-brand provider of information technology (IT) solutions to small,",Software Development; Cloud Management; Data Integration; Data Protection; Cloud Infrastructure; Cloud Storage; Network Security,CDW,NASDAQGS:CDW,CDW Corporation,both,"CDW Corporation provides information technology (IT) solutions in the United States, the United King","CDW Corporation provides information technology (IT) solutions in the United States, the United King"
L,Loews Corporation (NYSE:L),103455.0,Loews Corporation provides commercial property and casualty insurance in the United States and inter,"Loews Corporation, through its subsidiaries, engages in the commercial property and casualty insuran",Nutraceutical,L,NYSE:L,Loews Corporation,both,Loews Corporation provides commercial property and casualty insurance in the United States and inter,Loews Corporation provides commercial property and casualty insurance in the United States and inter
HII,"Huntington Ingalls Industries, Inc. (NYSE:HII)",4436418.0,"Huntington Ingalls Industries, Inc. designs, builds, overhauls, and repairs military ships in the Un","Huntington Ingalls Industries, Inc. (HII) operates as a global, all-domain defense partner, building",Disaster Recovery; Fleet Management; Industrial Automation; Marine Transportation; Simulation; Conventional Nuclear; Passenger Aircraft Manufacturing,HII,NYSE:HII,"Huntington Ingalls Industries, Inc.",both,"Huntington Ingalls Industries, Inc. designs, builds, overhauls, and repairs military ships in the Un","Huntington Ingalls Industries, Inc. designs, builds, overhauls, and repairs military ships in the Un"
AEP,"American Electric Power Company, Inc. (NASDAQGS:AEP)",4006321.0,"American Electric Power Company, Inc., an electric public utility holding company, engages in the ge","American Electric Power Company, Inc. (AEP) operates as an electric public utility holding company.
",Clean Energy; Energy Efficiency; Energy Management; Energy Storage; Smart Energy; Power Grid; Network Security; Utility Scale Solar,AEP,NASDAQGS:AEP,"American Electric Power Company, Inc.",both,"American Electric Power Company, Inc., an electric public utility holding company, engages in the ge","American Electric Power Company, Inc., an electric public utility holding company, engages in the ge"
HURN,Huron Consulting Group Inc. (NASDAQGS:HURN),4158666.0,"Huron Consulting Group Inc., a professional services firm, provides consultancy services in the Unit","Huron Consulting Group Inc. (Huron) operates as a global professional services company.

The company",Software Development; Cloud Management; Customer Analytics; E-learning; Cloud Infrastructure,HURN,NASDAQGS:HURN,Huron Consulting Group Inc.,both,"Huron Consulting Group Inc., a professional services firm, provides consultancy services in the Unit","Huron Consulting Group Inc., a professional services firm, provides consultancy services in the Unit"
DHR,Danaher Corporation (NYSE:DHR),4810677.0,"Danaher Corporation designs, manufactures, and markets professional, medical, industrial, and commer",Danaher Corporation (Danaher) operates as a global science and technology innovator committed to acc,Health Diagnostics; Genetics; Artificial Intelligence; Immunology; Oncology; Vaccines,DHR,NYSE:DHR,Danaher Corporation,both,"Danaher Corporation designs, manufactures, and markets professional, medical, industrial, and commer","Danaher Corporation designs, manufactures, and markets professional, medical, industrial, and commer"
NSIT,"Insight Enterprises, Inc. (NASDAQGS:NSIT)",4150271.0,"Insight Enterprises, Inc., together with its subsidiaries, provides information technology, hardware","Insight Enterprises, Inc. (Insight) provides end-to-end secure digital transformation solutions and ",Software Development; Cloud Management; Data Integration; Machine Learning; Cloud Infrastructure; Cloud Security; Artificial Intelligence,NSIT,NASDAQGS:NSIT,"Insight Enterprises, Inc.",both,"Insight Enterprises, Inc., together with its subsidiaries, provides information technology, hardware","Insight Enterprises, Inc., together with its subsidiaries, provides information technology, hardware"
KIM,Kimco Realty Corporation (NYSE:KIM),102965.0,Kimco Realty (NYSE: KIM) is a real estate investment trust (REIT) and leading owner and operator of ,nan,,KIM,NYSE:KIM,Kimco Realty Corporation,both,Kimco Realty (NYSE: KIM) is a real estate investment trust (REIT) and leading owner and operator of ,Kimco Realty (NYSE: KIM) is a real estate investment trust (REIT) and leading owner and operator of 
LVS,Las Vegas Sands Corp. (NYSE:LVS),4107929.0,"Las Vegas Sands Corp., together with its subsidiaries, develops, owns, and operates integrated resor",Las Vegas Sands Corp. operates as a global developer and operator of destination properties (Integra,Travel Accommodations,LVS,NYSE:LVS,Las Vegas Sands Corp.,both,"Las Vegas Sands Corp., together with its subsidiaries, develops, owns, and operates integrated resor","Las Vegas Sands Corp., together with its subsidiaries, develops, owns, and operates integrated resor"
TTI,"TETRA Technologies, Inc. (NYSE:TTI)",4071235.0,"TETRA Technologies, Inc., together with its subsidiaries, operates as an energy services and solutio","TETRA Technologies, Inc. (TETRA), together with its consolidated subsidiaries, is an energy services",Environmental Engineering; Disposal and Recycling; Water Purification; CleanTech; ClimateTech,TTI,NYSE:TTI,"TETRA Technologies, Inc.",both,"TETRA Technologies, Inc., together with its subsidiaries, operates as an energy services and solutio","TETRA Technologies, Inc., together with its subsidiaries, operates as an energy services and solutio"
GTLS,"Chart Industries, Inc. (NYSE:GTLS)",4295886.0,"Chart Industries, Inc. engages in the designing, engineering, and manufacturing of process technolog","Chart Industries, Inc. (Chart) operates as an independent global leader in the design, engineering, ",Energy Management; Environmental Engineering; ClimateTech,GTLS,NYSE:GTLS,"Chart Industries, Inc.",both,"Chart Industries, Inc. engages in the designing, engineering, and manufacturing of process technolog","Chart Industries, Inc. engages in the designing, engineering, and manufacturing of process technolog"
JBSS,"John B. Sanfilippo & Son, Inc. (NASDAQGS:JBSS)",4142572.0,"John B. Sanfilippo & Son, Inc., through its subsidiary, JBSS Ventures, LLC, processes and distribute","John B. Sanfilippo & Son, Inc. operates as the processor and distributor of peanuts, pecans, cashews",Farming; Brand Marketing,JBSS,NASDAQGS:JBSS,"John B. Sanfilippo & Son, Inc.",both,"John B. Sanfilippo & Son, Inc., through its subsidiary, JBSS Ventures, LLC, processes and distribute","John B. Sanfilippo & Son, Inc., through its subsidiary, JBSS Ventures, LLC, processes and distribute"
PEP,"PepsiCo, Inc. (NASDAQGS:PEP)",4004166.0,"PepsiCo, Inc. engages in the manufacture, marketing, distribution, and sale of various beverages and","PepsiCo, Inc. operates as beverage and convenient food company.

The company has a complementary por",Coffee,PEP,NASDAQGS:PEP,"PepsiCo, Inc.",both,"PepsiCo, Inc. engages in the manufacture, marketing, distribution, and sale of various beverages and","PepsiCo, Inc. engages in the manufacture, marketing, distribution, and sale of various beverages and"
WTW,Willis Towers Watson Public Limited Company (NASDAQGS:WTW),4248534.0,"Willis Towers Watson Public Limited Company operates as an advisory, broking, and solutions company ","Willis Towers Watson Public Limited Company (WTW) operates as an advisory, broking and solutions com",Employee Benefits; RegTech,WTW,NASDAQGS:WTW,Willis Towers Watson Public Limited Company,both,"Willis Towers Watson Public Limited Company operates as an advisory, broking, and solutions company ","Willis Towers Watson Public Limited Company operates as an advisory, broking, and solutions company "
SPLK,Splunk Inc. (NASDAQGM:SPLK),4279508.0,"Splunk Inc., together with its subsidiaries, develops and markets cloud services and licensed softwa","Splunk Inc., together with its subsidiaries, develops and markets cloud services and licensed softwa",Software Development; Cloud Management; Data Integration; Machine Learning; Cloud Infrastructure; Cloud Security; Artificial Intelligence,SPLK,NASDAQGM:SPLK,Splunk Inc.,both,nan,nan
FWRD,Forward Air Corporation (NASDAQGS:FWRD),4094244.0,"Forward Air Corporation, together with its subsidiaries, operates as an asset-light freight and logi","Forward Air Corporation (Forward) is a leading asset-light freight and logistics company.

The compa",EDI (Electronic Data Interchange); Fleet Management; Freight Service; Last Mile Transportation; Marine Transportation,FWRD,NASDAQGS:FWRD,Forward Air Corporation,both,"Forward Air Corporation, together with its subsidiaries, operates as an asset-light freight and logi","Forward Air Corporation, together with its subsidiaries, operates as an asset-light freight and logi"
NUE,Nucor Corporation (NYSE:NUE),4121108.0,Nucor Corporation engages in manufacture and sale of steel and steel products. It operates in three ,"Nucor Corporation and its affiliates (Nucor) manufacture steel and steel products.

The company also",Clean Energy; Environmental Engineering; Disposal and Recycling; CleanTech; Pollution Control; Green Steel,NUE,NYSE:NUE,Nucor Corporation,both,Nucor Corporation engages in manufacture and sale of steel and steel products. It operates in three ,Nucor Corporation engages in manufacture and sale of steel and steel products. It operates in three 
FOXA,Fox Corporation (NASDAQGS:FOXA),13518181.0,"Fox Corporation operates as a news, sports, and entertainment company in the United States (U.S.). T","Fox Corporation (FOX) operates as a news, sports and entertainment company.

The company produces an",Entertainment Systems; Ad Network; Video Streaming; Social Networking and Collaboration; Streaming Media; Video-on-Demand Servers; Content Creation,FOXA,NASDAQGS:FOXA,Fox Corporation,both,"Fox Corporation operates as a news, sports, and entertainment company in the United States (U.S.). T","Fox Corporation operates as a news, sports, and entertainment company in the United States (U.S.). T"
BCRX,"BioCryst Pharmaceuticals, Inc. (NASDAQGS:BCRX)",4812549.0,"BioCryst Pharmaceuticals, Inc., a biotechnology company, develops oral small-molecule and protein th","BioCryst Pharmaceuticals, Inc. operates as a global biotechnology company. The company leverages its",Health Diagnostics; Genetics; Genetic Disorder; Immunology; Infectious Diseases,BCRX,NASDAQGS:BCRX,"BioCryst Pharmaceuticals, Inc.",both,"BioCryst Pharmaceuticals, Inc., a biotechnology company, develops oral small-molecule and protein th","BioCryst Pharmaceuticals, Inc., a biotechnology company, develops oral small-molecule and protein th"
VAC,Marriott Vacations Worldwide Corporation (NYSE:VAC),4981115.0,"Marriott Vacations Worldwide Corporation, a vacation company, develops, markets, sells, and manages ",Marriott Vacations Worldwide Corporation operates as a leading global vacation company. The company ,Adventure Travel; Business Travel; Tourism; Travel Accommodations; Vacation Rental,VAC,NYSE:VAC,Marriott Vacations Worldwide Corporation,both,"Marriott Vacations Worldwide Corporation, a vacation company, develops, markets, sells, and manages ","Marriott Vacations Worldwide Corporation, a vacation company, develops, markets, sells, and manages "
PG,The Procter & Gamble Company (NYSE:PG),4004124.0,The Procter & Gamble Company engages in the provision of branded consumer packaged goods worldwide. ,"The Procter & Gamble Company operates as a multinational consumer goods company.

The company is foc",Green Consumer Goods; Lifestyle; Brand Marketing; Pain Management; Respiratory,PG,NYSE:PG,The Procter & Gamble Company,both,The Procter & Gamble Company engages in the provision of branded consumer packaged goods worldwide. ,The Procter & Gamble Company engages in the provision of branded consumer packaged goods worldwide. 
TMUS,"T-Mobile US, Inc. (NASDAQGS:TMUS)",4091145.0,"T-Mobile US, Inc., together with its subsidiaries, provides mobile communications services in the Un","T-Mobile US, Inc., together with its subsidiaries, operates as a provider of mobile communications s",Network Backbone; Location Based Services; VoIP; Wearables; Edge Computing; Network Security; 5G,TMUS,NASDAQGS:TMUS,"T-Mobile US, Inc.",both,"T-Mobile US, Inc., together with its subsidiaries, provides mobile communications services in the Un","T-Mobile US, Inc., together with its subsidiaries, provides mobile communications services in the Un"
AZZ,AZZ Inc. (NYSE:AZZ),4384044.0,AZZ Inc. provides hot-dip galvanizing and coil coating solutions in North America. It offers metal f,AZZ Inc. (AZZ) is a provider of hot-dip galvanizing and coil coating solutions to a broad range of e,,AZZ,NYSE:AZZ,AZZ Inc.,both,AZZ Inc. provides hot-dip galvanizing and coil coating solutions in North America. It offers metal f,AZZ Inc. provides hot-dip galvanizing and coil coating solutions in North America. It offers metal f
QCOM,QUALCOMM Incorporated (NASDAQGS:QCOM),4062496.0,QUALCOMM Incorporated engages in the development and commercialization of foundational technologies ,"QUALCOMM Incorporated (Qualcomm) is a global technology leader, helping to bring intelligent computi",Computer Vision; GPS; Sensors; Machine Learning; Smart Cities; Artificial Intelligence; 5G,QCOM,NASDAQGS:QCOM,QUALCOMM Incorporated,both,QUALCOMM Incorporated engages in the development and commercialization of foundational technologies ,QUALCOMM Incorporated engages in the development and commercialization of foundational technologies 
BWEN,"Broadwind, Inc. (NASDAQCM:BWEN)",4235589.0,"Broadwind, Inc. manufactures and sells structures, equipment, and components for clean tech and othe","Broadwind, Inc. operates as a precision manufacturer of structures, equipment and components for cle",Energy Management; Energy Storage; Industrial Automation; Packaging Services; Sensors; Process Automation,BWEN,NASDAQCM:BWEN,"Broadwind, Inc.",both,"Broadwind, Inc. manufactures and sells structures, equipment, and components for clean tech and othe","Broadwind, Inc. manufactures and sells structures, equipment, and components for clean tech and othe"
NFG,National Fuel Gas Company (NYSE:NFG),4010821.0,National Fuel Gas Company operates as a diversified energy company. It operates through four segment,"National Fuel Gas Company, an energy company, engages in the production, gathering, transportation, ",Environmental Engineering; Biomass Energy,NFG,NYSE:NFG,National Fuel Gas Company,both,National Fuel Gas Company operates as a diversified energy company. It operates through four segment,National Fuel Gas Company operates as a diversified energy company. It operates through four segment
KHC,The Kraft Heinz Company (NASDAQGS:KHC),4384788.0,"The Kraft Heinz Company, together with its subsidiaries, manufactures and markets food and beverage ",The Kraft Heinz Company (Kraft Heinz) operates as a global food and beverage company. The company le,Coffee; Online Grocery,KHC,NASDAQGS:KHC,The Kraft Heinz Company,both,"The Kraft Heinz Company, together with its subsidiaries, manufactures and markets food and beverage ","The Kraft Heinz Company, together with its subsidiaries, manufactures and markets food and beverage "
CHRD,Chord Energy Corporation (NASDAQGS:CHRD),4279207.0,Chord Energy Corporation operates as an independent exploration and production company in the United,"Chord Energy Corporation operates as an independent exploration and production (E&P) company.

The c",,CHRD,NASDAQGS:CHRD,Chord Energy Corporation,both,Chord Energy Corporation operates as an independent exploration and production company in the United,Chord Energy Corporation operates as an independent exploration and production company in the United
WIRE,Encore Wire Corporation (NASDAQGM:WIRE),4991023.0,Encore Wire Corporation engages in manufacture and sale of electrical building wires and cables in t,"Encore Wire Corporation (Encore) manufactures a broad range of electrical wire and cables, used to d",Smart Energy,WIRE,NASDAQGM:WIRE,Encore Wire Corporation,both,nan,nan
LNT,Alliant Energy Corporation (NASDAQGS:LNT),4057038.0,Alliant Energy is the parent company of two public utility companies - Interstate Power and Light Co,Alliant Energy Corporation (Alliant Energy) operates as a regulated investor-owned public utility ho,Clean Energy; Energy Efficiency; Energy Management; Energy Storage; Power Grid; Utility Scale Solar,LNT,NASDAQGS:LNT,Alliant Energy Corporation,both,Alliant Energy Corporation operates as a utility holding company that provides regulated electricity,Alliant Energy Corporation operates as a utility holding company that provides regulated electricity
AMR,"Alpha Metallurgical Resources, Inc. (NYSE:AMR)",4774297.0,"Alpha Metallurgical Resources, Inc., a mining company, produces, processes, and sells met and therma","Alpha Metallurgical Resources, Inc. operates as mining company with operations in Virginia and West ",Environmental Engineering,AMR,NYSE:AMR,"Alpha Metallurgical Resources, Inc.",both,"Alpha Metallurgical Resources, Inc., a mining company, produces, processes, and sells met and therma","Alpha Metallurgical Resources, Inc., a mining company, produces, processes, and sells met and therma"
SFM,"Sprouts Farmers Market, Inc. (NASDAQGS:SFM)",4096386.0,"Sprouts Farmers Market, Inc., together with its subsidiaries, engages in the retailing of fresh, nat","Sprouts Farmers Market, Inc. (Sprouts) operates as a specialty retailer of fresh, natural and organi",Farming; Fast-Moving Consumer Goods; Horticulture; Organic; Alternative Protein; Online Grocery,SFM,NASDAQGS:SFM,"Sprouts Farmers Market, Inc.",both,"Sprouts Farmers Market, Inc., together with its subsidiaries, engages in the retailing of fresh, nat","Sprouts Farmers Market, Inc., together with its subsidiaries, engages in the retailing of fresh, nat"
ENSG,"The Ensign Group, Inc. (NASDAQGS:ENSG)",4310438.0,"The Ensign Group, Inc. provides skilled nursing, senior living, and rehabilitative services. It oper","The Ensign Group, Inc. (Ensign) provides skilled nursing, senior living and rehabilitative services,",Health Diagnostics; Outpatient Care; Assisted Living; Cardiovascular; Nephrology; Orthopaedics; Respiratory,ENSG,NASDAQGS:ENSG,"The Ensign Group, Inc.",both,"The Ensign Group, Inc. provides skilled nursing, senior living, and rehabilitative services. It oper","The Ensign Group, Inc. provides skilled nursing, senior living, and rehabilitative services. It oper"
JELD,"JELD-WEN Holding, Inc. (NYSE:JELD)",6534026.0,"JELD-WEN Holding, Inc. designs, manufactures, and sells wood, metal, and composite materials doors, ","JELD-WEN Holding, Inc. operates as a leading global designer, manufacturer, and distributor of high-",Environmental Engineering; Salesforce Automation; Customer Relationship Management,JELD,NYSE:JELD,"JELD-WEN Holding, Inc.",both,"JELD-WEN Holding, Inc. designs, manufactures, and sells wood, metal, and composite materials doors, ","JELD-WEN Holding, Inc. designs, manufactures, and sells wood, metal, and composite materials doors, "
