tic,SP_ENTITY_NAME,SP_ENTITY_ID,SP_BUSINESS_DESCRIPTION,SP_LONG_BUSINESS_DESCRIPTION,SP_TOPICTAG,SP_TICKER,SP_EXCHANGE_TICKER,SP_COMPANY_NAME,_merge,YH_BUS_DESC,SA_BUS_DESC
WTS,"Watts Water Technologies, Inc. (NYSE:WTS)",4992863.0,"Watts Water Technologies, Inc., together with its subsidiaries, supplies products and solutions that","Watts Water Technologies, Inc. operates as a provider of water technologies and solutions that are d",Environmental Engineering; Water Purification; CleanTech,WTS,NYSE:WTS,"Watts Water Technologies, Inc.",both,"Watts Water Technologies, Inc., together with its subsidiaries, supplies products and solutions that","Watts Water Technologies, Inc., together with its subsidiaries, supplies products and solutions that"
ROL,"Rollins, Inc. (NYSE:ROL)",4004396.0,"Rollins, Inc., through its subsidiaries, provides pest and wildlife control services to residential ","Rollins, Inc. (Rollins) operates as an international services company.

The company, through its fam",Pet Care,ROL,NYSE:ROL,"Rollins, Inc.",both,"Rollins, Inc., through its subsidiaries, provides pest and wildlife control services to residential ","Rollins, Inc., through its subsidiaries, provides pest and wildlife control services to residential "
VTRS,Viatris Inc. (NASDAQGS:VTRS),4761964.0,Viatris Inc. operates as a healthcare company worldwide. The company operates in four segments: Deve,"Viatris Inc. (Viatris) operates as a healthcare company worldwide.

With a global workforce of appro",Health Diagnostics; Cardiovascular; Central Nervous System; Dermatology; Infectious Diseases; Oncology; Ophthalmology,VTRS,NASDAQGS:VTRS,Viatris Inc.,both,Viatris Inc. operates as a healthcare company worldwide. The company operates in four segments: Deve,Viatris Inc. operates as a healthcare company worldwide. The company operates in four segments: Deve
MTX,Minerals Technologies Inc. (NYSE:MTX),4985914.0,"Minerals Technologies Inc. develops, produces, and markets various mineral, mineral-based, and relat","Minerals Technologies Inc. is a leading, technology-driven specialty minerals company that develops,",Environmental Consulting; Environmental Engineering; Pollution Control; Biofuel,MTX,NYSE:MTX,Minerals Technologies Inc.,both,"Minerals Technologies Inc. develops, produces, and markets various mineral, mineral-based, and relat","Minerals Technologies Inc. develops, produces, and markets various mineral, mineral-based, and relat"
ARCB,ArcBest Corporation (NASDAQGS:ARCB),4994138.0,"ArcBest Corporation, an integrated logistics company, engages in the provision of ground, air, and o",ArcBest Corporation and its subsidiaries (ArcBest) operate as a multibillion-dollar integrated logis,Fleet Management; Freight Service; GPS; Last Mile Transportation,ARCB,NASDAQGS:ARCB,ArcBest Corporation,both,"ArcBest Corporation, an integrated logistics company, engages in the provision of ground, air, and o","ArcBest Corporation, an integrated logistics company, engages in the provision of ground, air, and o"
NKE,"NIKE, Inc. (NYSE:NKE)",4004236.0,"NIKE, Inc., together with its subsidiaries, engages in the design, development, marketing, and sale ","NIKE, Inc. (NIKE) engages in the design, development and worldwide marketing and selling of athletic",Fitness; Lifestyle,NKE,NYSE:NKE,"NIKE, Inc.",both,"NIKE, Inc., together with its subsidiaries, engages in the design, development, marketing, and sale ","NIKE, Inc., together with its subsidiaries, engages in the design, development, marketing, and sale "
AMCR,Amcor plc (NYSE:AMCR),4160328.0,"Amcor plc develops, produces, and sells packaging products in Europe, North America, Latin America, ",Amcor plc operates as a global leader in developing and producing responsible packaging solutions ac,Packaging Services,AMCR,NYSE:AMCR,Amcor plc,both,"Amcor plc develops, produces, and sells packaging products in Europe, North America, Latin America, ","Amcor plc develops, produces, and sells packaging products in Europe, North America, Latin America, "
YUM,"Yum! Brands, Inc. (NYSE:YUM)",4025819.0,"Yum! Brands, Inc., together with its subsidiaries, develops, operates, and franchises quick service ","Yum! Brands, Inc. (YUM), together with its subsidiaries, develops, operates, and franchises a worldw",Food Delivery,YUM,NYSE:YUM,"Yum! Brands, Inc.",both,"Yum! Brands, Inc., together with its subsidiaries, develops, operates, and franchises quick service ","Yum! Brands, Inc., together with its subsidiaries, develops, operates, and franchises quick service "
PKG,Packaging Corporation of America (NYSE:PKG),4062146.0,Packaging Corporation of America manufactures and sells containerboard and corrugated packaging prod,Packaging Corporation of America produces containerboard products and uncoated freesheet (UFS) paper,Packaging Services; Biomass Energy,PKG,NYSE:PKG,Packaging Corporation of America,both,Packaging Corporation of America manufactures and sells containerboard and corrugated packaging prod,Packaging Corporation of America manufactures and sells containerboard and corrugated packaging prod
DAL,"Delta Air Lines, Inc. (NYSE:DAL)",4004278.0,"Delta Air Lines, Inc. provides scheduled air transportation for passengers and cargo in the United S","Delta Air Lines, Inc. (Delta) operates as a global airline based in the United States.

The company ",Business Travel; Fleet Management; Freight Service; Passenger Aircraft Manufacturing,DAL,NYSE:DAL,"Delta Air Lines, Inc.",both,"Delta Air Lines, Inc. provides scheduled air transportation for passengers and cargo in the United S","Delta Air Lines, Inc. provides scheduled air transportation for passengers and cargo in the United S"
ADNT,Adient plc (NYSE:ADNT),4915451.0,"Adient plc engages in the design, development, manufacture, and market of seating systems and compon",Adient plc (Adient) is a global leader in the automotive seating supply industry with leading market,,ADNT,NYSE:ADNT,Adient plc,both,"Adient plc engages in the design, development, manufacture, and market of seating systems and compon","Adient plc engages in the design, development, manufacture, and market of seating systems and compon"
IEP,Icahn Enterprises L.P. (NASDAQGS:IEP),4044522.0,"Icahn Enterprises L.P., through its subsidiaries, engages in the investment, energy, automotive, foo",Icahn Enterprises L.P. (Icahn Enterprises) is a diversified holding company owning subsidiaries enga,Farming,IEP,NASDAQGS:IEP,Icahn Enterprises L.P.,both,"Icahn Enterprises L.P., through its subsidiaries, engages in the investment, energy, automotive, foo","Icahn Enterprises L.P., through its subsidiaries, engages in the investment, energy, automotive, foo"
TWTR,"Twitter, Inc. (NYSE:TWTR)",4211154.0,"As of March 31, 2023, Twitter, Inc. was acquired by X Corp. Twitter, Inc. operates as a platform for","Twitter, Inc. (Twitter) operates as a platform for public self-expression and conversation in real t",Streaming Media,TWTR,NYSE:TWTR,"Twitter, Inc.",both,nan,nan
EQT,EQT Corporation (NYSE:EQT),4004341.0,EQT Corporation operates as a natural gas production company in the United States. The company sells,EQT Corporation operates as a natural gas production company with operations focused in the Appalach,Energy Storage; Utility Scale Solar,EQT,NYSE:EQT,EQT Corporation,both,EQT Corporation operates as a natural gas production company in the United States. The company sells,EQT Corporation operates as a natural gas production company in the United States. The company sells
AMRX,"Amneal Pharmaceuticals, Inc. (NASDAQGS:AMRX)",5139125.0,"Amneal Pharmaceuticals, Inc., together with its subsidiaries, develops, manufactures, markets, and d","Amneal Pharmaceuticals, Inc. is a global pharmaceutical company that develops, manufactures, markets",Health Diagnostics; Central Nervous System; Endocrinology; Inflammation; Neurology; Ophthalmology; Respiratory,AMRX,NASDAQGS:AMRX,"Amneal Pharmaceuticals, Inc.",both,"Amneal Pharmaceuticals, Inc., together with its subsidiaries, develops, manufactures, markets, and d","Amneal Pharmaceuticals, Inc., together with its subsidiaries, develops, manufactures, markets, and d"
GRPN,"Groupon, Inc. (NASDAQGS:GRPN)",4258132.0,"Groupon, Inc., together with its subsidiaries, operates a marketplace that connects consumers to mer","Groupon, Inc. (Groupon) operates as a global scaled two-sided marketplace that connects consumers to",Adventure Travel; Location Based Services; Tourism; Travel Accommodations; Customer Relationship Management; App Marketing; Collaborative Consumption,GRPN,NASDAQGS:GRPN,"Groupon, Inc.",both,"Groupon, Inc., together with its subsidiaries, operates a marketplace that connects consumers to mer","Groupon, Inc., together with its subsidiaries, operates a marketplace that connects consumers to mer"
VRE,"Veris Residential, Inc. (NYSE:VRE)",103187.0,"Veris Residential, Inc. is a forward-thinking, environmentally and socially conscious real estate in",nan,Lifestyle,VRE,NYSE:VRE,"Veris Residential, Inc.",both,"Veris Residential, Inc. is a forward-thinking, environmentally and socially conscious real estate in","Veris Residential, Inc. is a forward-thinking, environmentally and socially conscious real estate in"
HT,Hersha Hospitality Trust (NYSE:HT),4019891.0,Hersha Hospitality Trust (HT) is a self-advised real estate investment trust in the hospitality sect,nan,Lifestyle,HT,NYSE:HT,Hersha Hospitality Trust,both,nan,nan
HBP,"Huttig Building Products, Inc. (NASDAQGM:HBP)",4129541.0,"Huttig Building Products, Inc., together with its subsidiaries, distributes millwork, building mater","Huttig Building Products, Inc. operates as a domestic distributor of millwork, building materials, a",Home Improvement,HBP,NASDAQGM:HBP,"Huttig Building Products, Inc.",both,nan,nan
STLD,"Steel Dynamics, Inc. (NASDAQGS:STLD)",4120616.0,"Steel Dynamics, Inc., together with its subsidiaries, operates as a steel producer and metal recycle","Steel Dynamics, Inc. operates as a domestic steel producer and metal recycler in the United States. ",Environmental Engineering; Disposal and Recycling; CleanTech,STLD,NASDAQGS:STLD,"Steel Dynamics, Inc.",both,"Steel Dynamics, Inc., together with its subsidiaries, operates as a steel producer and metal recycle","Steel Dynamics, Inc., together with its subsidiaries, operates as a steel producer and metal recycle"
ABMD,"Abiomed, Inc. (NASDAQGS:ABMD)",4812233.0,"Abiomed, Inc. engages in the research, development, manufacturing, and sale of medical devices to as","ABIOMED, Inc. provides medical devices that provide circulatory support and oxygenation. The company","Sensors; Detectors, Sensors and Mems; Cardiovascular; Surgery",ABMD,NASDAQGS:ABMD,"Abiomed, Inc.",both,nan,nan
CROX,"Crocs, Inc. (NASDAQGS:CROX)",4155562.0,"Crocs, Inc., together with its subsidiaries, designs, develops, manufactures, markets, distributes, ","Crocs, Inc. operates as a footwear company worldwide.

The company and its consolidated subsidiaries",Lifestyle,CROX,NASDAQGS:CROX,"Crocs, Inc.",both,"Crocs, Inc., together with its subsidiaries, designs, develops, manufactures, markets, distributes, ","Crocs, Inc., together with its subsidiaries, designs, develops, manufactures, markets, distributes, "
LEN,Lennar Corporation (NYSE:LEN),4054537.0,"Lennar Corporation, together with its subsidiaries, operates as a homebuilder primarily under the Le","Lennar Corporation operates as a homebuilder in the United States.

The company is an originator of ",Marketing Automation; Predictive Analytics; Smart Building; Real Estate Technology,LEN,NYSE:LEN,Lennar Corporation,both,"Lennar Corporation, together with its subsidiaries, operates as a homebuilder primarily under the Le","Lennar Corporation, together with its subsidiaries, operates as a homebuilder primarily under the Le"
DG,Dollar General Corporation (NYSE:DG),4022058.0,"Dollar General Corporation, a discount retailer, provides various merchandise products in the southe","Dollar General Corporation operates as a discount retailer in the United States.

The company has va",Fast-Moving Consumer Goods,DG,NYSE:DG,Dollar General Corporation,both,"Dollar General Corporation, a discount retailer, provides various merchandise products in the southe","Dollar General Corporation, a discount retailer, provides various merchandise products in the southe"
LPX,Louisiana-Pacific Corporation (NYSE:LPX),4061160.0,"Louisiana-Pacific Corporation, together with its subsidiaries, provides building solutions primarily",Louisiana-Pacific Corporation (LP) provides high-performance building solutions that meet the demand,Environmental Engineering; Horticulture,LPX,NYSE:LPX,Louisiana-Pacific Corporation,both,"Louisiana-Pacific Corporation, together with its subsidiaries, provides building solutions primarily","Louisiana-Pacific Corporation, together with its subsidiaries, provides building solutions primarily"
VMC,Vulcan Materials Company (NYSE:VMC),4063773.0,"Vulcan Materials Company, together with its subsidiaries, produces and supplies construction aggrega","Vulcan Materials Company supplies construction aggregates (primarily crushed stone, sand and gravel)",,VMC,NYSE:VMC,Vulcan Materials Company,both,"Vulcan Materials Company, together with its subsidiaries, produces and supplies construction aggrega","Vulcan Materials Company, together with its subsidiaries, produces and supplies construction aggrega"
BDC,Belden Inc. (NYSE:BDC),4198848.0,"Belden Inc. designs, manufactures, and markets a portfolio of signal transmission solutions for miss",Belden Inc. (Belden) operates as a global supplier of network infrastructure and digitization soluti,Industrial Automation; Sensors; Smart Building; Process Automation; Network Security; Data Center Technology; 5G,BDC,NYSE:BDC,Belden Inc.,both,"Belden Inc. designs, manufactures, and markets a portfolio of signal transmission solutions for miss","Belden Inc. designs, manufactures, and markets a portfolio of signal transmission solutions for miss"
CVLG,"Covenant Logistics Group, Inc. (NYSE:CVLG)",4407542.0,"Covenant Logistics Group, Inc., together with its subsidiaries, provides transportation and logistic","Covenant Logistics Group, Inc. provides expedited freight transportation, primarily using two-person",EDI (Electronic Data Interchange); Fleet Management; Freight Service; GPS; Courier Service,CVLG,NYSE:CVLG,"Covenant Logistics Group, Inc.",both,"Covenant Logistics Group, Inc., together with its subsidiaries, provides transportation and logistic","Covenant Logistics Group, Inc., together with its subsidiaries, provides transportation and logistic"
DVA,DaVita Inc. (NYSE:DVA),4189919.0,DaVita Inc. provides kidney dialysis services for patients suffering from chronic kidney failure in ,DaVita Inc. (DaVita) operates as a healthcare provider focused on transforming care delivery to impr,Health Diagnostics; Chronic Diseases; Nephrology,DVA,NYSE:DVA,DaVita Inc.,both,DaVita Inc. provides kidney dialysis services for patients suffering from chronic kidney failure in ,DaVita Inc. provides kidney dialysis services for patients suffering from chronic kidney failure in 
AGCO,AGCO Corporation (NYSE:AGCO),4309089.0,AGCO Corporation manufactures and distributes agricultural equipment and related replacement parts w,"AGCO Corporation (AGCO) operates as a global leader in the design, manufacture and distribution of a",Data Integration; Farming; Horticulture; Livestock,AGCO,NYSE:AGCO,AGCO Corporation,both,AGCO Corporation manufactures and distributes agricultural equipment and related replacement parts w,AGCO Corporation manufactures and distributes agricultural equipment and related replacement parts w
LUV,Southwest Airlines Co. (NYSE:LUV),4121199.0,Southwest Airlines Co. operates as a passenger airline company that provides scheduled air transport,"Southwest Airlines Co. (Southwest) operates Southwest Airlines, a major passenger airline that provi",Adventure Travel; Business Travel; Customer Relationship Management; DaaS,LUV,NYSE:LUV,Southwest Airlines Co.,both,Southwest Airlines Co. operates as a passenger airline company that provides scheduled air transport,Southwest Airlines Co. operates as a passenger airline company that provides scheduled air transport
FSS,Federal Signal Corporation (NYSE:FSS),4210001.0,"Federal Signal Corporation, together with its subsidiaries, designs, manufactures, and supplies a su","Federal Signal Corporation designs, manufactures, and supplies a suite of products and integrated so",Environmental Engineering; Fleet Management; Industrial Automation; Disposal and Recycling,FSS,NYSE:FSS,Federal Signal Corporation,both,"Federal Signal Corporation, together with its subsidiaries, designs, manufactures, and supplies a su","Federal Signal Corporation, together with its subsidiaries, designs, manufactures, and supplies a su"
SEE,Sealed Air Corporation (NYSE:SEE),4766281.0,"Sealed Air Corporation provides packaging solutions in the Americas, Europe, the Middle East, Africa",Sealed Air Corporation is a leading global provider of packaging solutions that integrate sustainabl,Food Delivery; Industrial Automation; Packaging Services,SEE,NYSE:SEE,Sealed Air Corporation,both,"Sealed Air Corporation provides packaging solutions in the Americas, Europe, the Middle East, Africa","Sealed Air Corporation provides packaging solutions in the Americas, Europe, the Middle East, Africa"
ON,ON Semiconductor Corporation (NASDAQGS:ON),4133677.0,ON Semiconductor Corporation provides intelligent sensing and power solutions in the United States a,ON Semiconductor Corporation provides intelligent power and intelligent sensing solutions with a pri,Computer Vision; Image Recognition; Sensors; Smart Cities; Smart Energy; Edge Computing; Autonomous Vehicles; Battery Energy Storage System (BESS),ON,NASDAQGS:ON,ON Semiconductor Corporation,both,ON Semiconductor Corporation provides intelligent sensing and power solutions in the United States a,ON Semiconductor Corporation provides intelligent sensing and power solutions in the United States a
GSBC,"Great Southern Bancorp, Inc. (NASDAQGS:GSBC)",101830.0,"Great Southern Bancorp, Inc. operates as a bank holding company for Great Southern Bank that provide","Great Southern Bancorp, Inc. operates as the bank holding company for Great Southern Bank that offer",Consumer Lending,GSBC,NASDAQGS:GSBC,"Great Southern Bancorp, Inc.",both,"Great Southern Bancorp, Inc. operates as a bank holding company for Great Southern Bank that provide","Great Southern Bancorp, Inc. operates as a bank holding company for Great Southern Bank that provide"
ESE,ESCO Technologies Inc. (NYSE:ESE),4992486.0,"ESCO Technologies Inc. provides engineered filtration and fluid control products, and integrated pro","ESCO Technologies Inc., through its wholly-owned direct and indirect subsidiaries, operates as a maj",Energy Storage; Industrial Automation; Sensors; Process Automation; Ocean Data Collection,ESE,NYSE:ESE,ESCO Technologies Inc.,both,ESCO Technologies Inc. produces and supplies engineered products and systems for industrial and comm,"ESCO Technologies Inc. provides engineered filtration and fluid control products, and integrated pro"
GNRC,Generac Holdings Inc. (NYSE:GNRC),4991196.0,"Generac Holdings Inc. designs, manufactures, and distributes various energy technology products and ","Generac Holdings Inc. (Generac) operates as an energy technology solutions company.

The company pro",Energy Management; Energy Storage; Industrial Automation; Smart Energy; Remote Access and Control,GNRC,NYSE:GNRC,Generac Holdings Inc.,both,"Generac Holdings Inc. designs, manufactures, and distributes various energy technology products and ","Generac Holdings Inc. designs, manufactures, and distributes various energy technology products and "
XYL,Xylem Inc. (NYSE:XYL),4317520.0,"Xylem Inc., together with its subsidiaries, engages in the design, manufacture, and servicing of eng","Xylem Inc. (Xylem) operates as a global water technology company.

The company designs, manufactures",Energy Management; Industrial Automation; Sensors; Water Purification; Process Automation; Remote Access and Control,XYL,NYSE:XYL,Xylem Inc.,both,"Xylem Inc., together with its subsidiaries, engages in the design, manufacture, and servicing of eng","Xylem Inc., together with its subsidiaries, engages in the design, manufacture, and servicing of eng"
JNPR,"Juniper Networks, Inc. (NYSE:JNPR)",4157184.0,"Juniper Networks, Inc. designs, develops, and sells network products and services worldwide. The com","Juniper Networks, Inc. (Juniper Networks) designs, develops, and sells products and services for hig",Cloud Management; Cloud Infrastructure; Cloud Security; Process Automation; Network Security,JNPR,NYSE:JNPR,"Juniper Networks, Inc.",both,"Juniper Networks, Inc. designs, develops, and sells network products and services worldwide. The com","Juniper Networks, Inc. designs, develops, and sells network products and services worldwide. The com"
SMG,The Scotts Miracle-Gro Company (NYSE:SMG),4397865.0,"The Scotts Miracle-Gro Company, together with its subsidiaries, engages in the manufacture, marketin","The Scotts Miracle-Gro Company engages in the manufacture, marketing, and sale of products for lawn,",Farming; Horticulture; Hydroponics; Organic,SMG,NYSE:SMG,The Scotts Miracle-Gro Company,both,"The Scotts Miracle-Gro Company, together with its subsidiaries, engages in the manufacture, marketin","The Scotts Miracle-Gro Company, together with its subsidiaries, engages in the manufacture, marketin"
MLR,"Miller Industries, Inc. (NYSE:MLR)",4988965.0,"Miller Industries, Inc., together with its subsidiaries, manufactures and sells towing and recovery ","Miller Industries, Inc. designs and manufactures bodies of car carriers and wreckers, which are inst",Fleet Management; Freight Service,MLR,NYSE:MLR,"Miller Industries, Inc.",both,"Miller Industries, Inc., together with its subsidiaries, manufactures and sells towing and recovery ","Miller Industries, Inc., together with its subsidiaries, manufactures and sells towing and recovery "
AEHR,"Aehr Test Systems, Inc. (NASDAQCM:AEHR)",4963251.0,"Aehr Test Systems, Inc. provides test solutions for testing, burning-in, and semiconductor devices i","Aehr Test Systems, Inc. (Aehr Test Systems) engages in the design, manufacture, marketing, and sale ",Industrial Automation; Sensors; Process Automation; Data Centers and Facilities; Storage Management; Artificial Intelligence,AEHR,NASDAQCM:AEHR,"Aehr Test Systems, Inc.",both,"Aehr Test Systems, Inc. provides test solutions for testing, burning-in, and semiconductor devices i","Aehr Test Systems, Inc. provides test solutions for testing, burning-in, and semiconductor devices i"
BERY,"Berry Global Group, Inc. (NYSE:BERY)",4635041.0,"Berry Global Group, Inc. manufactures and supplies products in consumer and industrial end markets i","Berry Global Group, Inc. (Berry) operates as a global supplier of a broad range of innovative rigid,",Green Consumer Goods,BERY,NYSE:BERY,"Berry Global Group, Inc.",both,"Berry Global Group, Inc. manufactures and supplies products in consumer and industrial end markets i","Berry Global Group, Inc. manufactures and supplies products in consumer and industrial end markets i"
ORI,Old Republic International Corporation (NYSE:ORI),103407.0,"Old Republic International Corporation, through its subsidiaries, engages in the insurance underwrit","Old Republic International Corporation, through its subsidiaries (Old Republic), engages in the busi",,ORI,NYSE:ORI,Old Republic International Corporation,both,"Old Republic International Corporation, through its subsidiaries, engages in the insurance underwrit","Old Republic International Corporation, through its subsidiaries, engages in the insurance underwrit"
DOV,Dover Corporation (NYSE:DOV),4068060.0,"Dover Corporation provides equipment and components, consumable supplies, aftermarket parts, softwar",Dover Corporation (Dover) operates as a diversified global manufacturer and solutions provider deliv,Energy Storage; Fleet Management; Industrial Automation; Process Automation,DOV,NYSE:DOV,Dover Corporation,both,"Dover Corporation provides equipment and components, consumable supplies, aftermarket parts, softwar","Dover Corporation provides equipment and components, consumable supplies, aftermarket parts, softwar"
ENB,Enbridge Inc. (TSX:ENB),4089108.0,"Enbridge Inc., together with its subsidiaries, operates as an energy infrastructure company. The com","Enbridge Inc. (Enbridge) operates as an energy infrastructure company in North America.

The company",Clean Energy; Energy Management; Energy Storage; Freight Service; Marine Transportation; CleanTech; Conventional Nuclear; Biomass Energy; Power Grid; Utility Scale Solar; Onshore and Offshore Wind,ENB,TSX:ENB,Enbridge Inc.,both,"Enbridge Inc., together with its subsidiaries, operates as an energy infrastructure company. The com","Enbridge Inc., together with its subsidiaries, operates as an energy infrastructure company. The com"
TPR,"Tapestry, Inc. (NYSE:TPR)",4112718.0,"Tapestry, Inc. provides luxury accessories and branded lifestyle products in North America, Greater ","Tapestry, Inc. (Tapestry) operates as a house of iconic accessories and lifestyle brands.

The compa",Lifestyle; Brand Marketing,TPR,NYSE:TPR,"Tapestry, Inc.",both,"Tapestry, Inc. provides luxury accessories and branded lifestyle products in North America, Greater ","Tapestry, Inc. provides luxury accessories and branded lifestyle products in North America, Greater "
